<?xml version="1.0" encoding="utf-8"?>
<!DOCTYPE nta PUBLIC "-//Uppaal Team//DTD Flat System 1.1//EN" "flat-1_1.dtd">
<nta>
	<declaration>// Place global declarations here.
broadcast chan Q_reached, R_reached, P_entered, S_entered, ZS_reached;
bool R_holds;</declaration>
	<template>
		<name x="5" y="5">ResponseConstrained_State_Between_Untimed</name>
		<declaration>// Place local declarations here.
clock c;
int l = 3;
int u = 5;</declaration>
		<location id="id0" x="85" y="-144">
		</location>
		<location id="id1" x="-340" y="-178">
			<committed/>
		</location>
		<location id="id2" x="204" y="-178">
			<name x="194" y="-212">ERROR</name>
		</location>
		<location id="id3" x="-476" y="-178">
		</location>
		<location id="id4" x="-25" y="-178">
		</location>
		<location id="id5" x="-195" y="-178">
		</location>
		<init ref="id3"/>
		<transition>
			<source ref="id0"/>
			<target ref="id2"/>
			<label kind="synchronisation" x="103" y="-161">R_reached?</label>
			<nail x="204" y="-144"/>
		</transition>
		<transition>
			<source ref="id4"/>
			<target ref="id0"/>
			<label kind="synchronisation" x="-17" y="-161">ZS_reached?</label>
			<nail x="-25" y="-144"/>
		</transition>
		<transition>
			<source ref="id1"/>
			<target ref="id3"/>
			<label kind="guard" x="-459" y="-153">R_holds == 1</label>
			<nail x="-357" y="-153"/>
			<nail x="-459" y="-153"/>
		</transition>
		<transition>
			<source ref="id1"/>
			<target ref="id5"/>
			<label kind="guard" x="-314" y="-195">R_holds == 0</label>
		</transition>
		<transition>
			<source ref="id3"/>
			<target ref="id1"/>
			<label kind="synchronisation" x="-458" y="-195">Q_reached?</label>
		</transition>
		<transition>
			<source ref="id5"/>
			<target ref="id3"/>
			<label kind="synchronisation" x="-459" y="-85">R_reached?</label>
			<nail x="-195" y="-93"/>
			<nail x="-476" y="-93"/>
		</transition>
		<transition>
			<source ref="id4"/>
			<target ref="id2"/>
			<label kind="synchronisation" x="42" y="-195">R_reached?</label>
		</transition>
		<transition>
			<source ref="id4"/>
			<target ref="id5"/>
			<label kind="synchronisation" x="-136" y="-94">S_entered?</label>
			<nail x="-102" y="-94"/>
		</transition>
		<transition>
			<source ref="id5"/>
			<target ref="id4"/>
			<label kind="synchronisation" x="-177" y="-195">P_entered?</label>
		</transition>
	</template>
	<system>// Place template instantiations here.
Process = ResponseConstrained_State_Between_Untimed();
// List one or more processes to be composed into a system.
system Process;
    </system>
	<queries>
	</queries>
</nta>
