<?xml version="1.0" encoding="utf-8"?>
<!DOCTYPE nta PUBLIC "-//Uppaal Team//DTD Flat System 1.1//EN" "flat-1_1.dtd">
<nta>
	<declaration>// Place global declarations here.
broadcast chan P_reached;</declaration>
	<template>
		<name x="5" y="5">MaximumDuration_State_Globally_Timed</name>
		<declaration>// Place local declarations here.
clock c;</declaration>
		<location id="id0" x="-408" y="-170">
		</location>
		<location id="id1" x="-272" y="-170">
			<name x="-255" y="-178">Scope</name>
		</location>
		<init ref="id0"/>
		<transition>
			<source ref="id0"/>
			<target ref="id1"/>
			<label kind="synchronisation" x="-382" y="-187">P_reached?</label>
			<label kind="assignment" x="-382" y="-170">c = 0</label>
		</transition>
		<transition>
			<source ref="id1"/>
			<target ref="id1"/>
			<label kind="synchronisation" x="-263" y="-229">P_reached?</label>
			<label kind="assignment" x="-263" y="-204">c = 0</label>
			<nail x="-272" y="-204"/>
			<nail x="-187" y="-204"/>
			<nail x="-187" y="-119"/>
			<nail x="-272" y="-119"/>
		</transition>
	</template>
	<system>// Place template instantiations here.
Observer = MaximumDuration_State_Globally_Timed();
// List one or more processes to be composed into a system.
system Observer;
    </system>
	<queries>
		<query>
			<formula>A[] (Observer.Scope and Observer.c &gt;= $t1) imply $P
			</formula>
			<comment>
			</comment>
		</query>
	</queries>
</nta>
