<?xml version="1.0" encoding="utf-8"?>
<!DOCTYPE nta PUBLIC "-//Uppaal Team//DTD Flat System 1.1//EN" "flat-1_1.dtd">
<nta>
	<declaration>// Place global declarations here.
bool R_holds, P_holds;
broadcast chan R_reached, Q_reached, P_reached, P_left;
int n_;</declaration>
	<template>
		<name x="5" y="5">BoundedExistence_State_Between_Untimed</name>
		<declaration>// Place local declarations here.
int counter = 0;</declaration>
		<location id="id0" x="-748" y="-340">
			<committed/>
		</location>
		<location id="id1" x="-875" y="-340">
			<name x="-909" y="-331">INIT</name>
		</location>
		<location id="id2" x="178" y="-467">
			<name x="195" y="-475">ERROR</name>
		</location>
		<location id="id3" x="59" y="-467">
		</location>
		<location id="id4" x="-93" y="-467">
			<committed/>
		</location>
		<location id="id5" x="-476" y="-340">
			<committed/>
		</location>
		<location id="id6" x="-280" y="-467">
		</location>
		<location id="id7" x="-280" y="-340">
		</location>
		<location id="id8" x="-603" y="-340">
			<committed/>
		</location>
		<init ref="id1"/>
		<transition>
			<source ref="id0"/>
			<target ref="id1"/>
			<label kind="guard" x="-858" y="-416">R_holds == 1</label>
			<nail x="-748" y="-391"/>
			<nail x="-875" y="-391"/>
		</transition>
		<transition>
			<source ref="id0"/>
			<target ref="id8"/>
			<label kind="guard" x="-722" y="-365">R_holds == 0</label>
		</transition>
		<transition>
			<source ref="id1"/>
			<target ref="id0"/>
			<label kind="synchronisation" x="-857" y="-357">Q_reached?</label>
		</transition>
		<transition>
			<source ref="id6"/>
			<target ref="id1"/>
			<label kind="synchronisation" x="-654" y="-535">R_reached?</label>
			<nail x="-280" y="-510"/>
			<nail x="-909" y="-510"/>
			<nail x="-909" y="-340"/>
		</transition>
		<transition>
			<source ref="id7"/>
			<target ref="id1"/>
			<label kind="synchronisation" x="-858" y="-323">R_reached?</label>
			<nail x="-280" y="-306"/>
			<nail x="-875" y="-306"/>
		</transition>
		<transition>
			<source ref="id3"/>
			<target ref="id2"/>
			<label kind="synchronisation" x="76" y="-493">R_reached?</label>
		</transition>
		<transition>
			<source ref="id4"/>
			<target ref="id3"/>
			<label kind="guard" x="-68" y="-493">counter &gt; n_</label>
		</transition>
		<transition>
			<source ref="id4"/>
			<target ref="id6"/>
			<label kind="guard" x="-246" y="-493">counter &lt;= n_</label>
		</transition>
		<transition>
			<source ref="id7"/>
			<target ref="id4"/>
			<label kind="synchronisation" x="-238" y="-374">P_reached?</label>
			<label kind="assignment" x="-255" y="-357">counter = counter+1</label>
			<nail x="-93" y="-340"/>
		</transition>
		<transition>
			<source ref="id5"/>
			<target ref="id6"/>
			<label kind="guard" x="-467" y="-484">P_holds == 1</label>
			<label kind="assignment" x="-467" y="-467">counter = counter+1</label>
			<nail x="-476" y="-467"/>
		</transition>
		<transition>
			<source ref="id5"/>
			<target ref="id7"/>
			<label kind="guard" x="-433" y="-365">P_holds == 0</label>
		</transition>
		<transition>
			<source ref="id8"/>
			<target ref="id5"/>
			<label kind="assignment" x="-586" y="-365">counter = 0</label>
		</transition>
		<transition>
			<source ref="id6"/>
			<target ref="id7"/>
			<label kind="synchronisation" x="-272" y="-425">P_left?</label>
		</transition>
	</template>
	<system>// Place template instantiations here.
Observer = BoundedExistence_State_Between_Untimed();
// List one or more processes to be composed into a system.
system Observer;
    </system>
	<queries>
		<query>
			<formula>A[] Observer.INIT imply not $Q
			</formula>
			<comment>
			</comment>
		</query>
		<query>
			<formula>A[] not Observer.ERROR
			</formula>
			<comment>
			</comment>
		</query>
	</queries>
</nta>
