<?xml version="1.0" encoding="utf-8"?>
<!DOCTYPE nta PUBLIC "-//Uppaal Team//DTD Flat System 1.1//EN" "flat-1_1.dtd">
<nta>
	<declaration>// Place global declarations here.
broadcast chan P_reached, R_reached;
bool R_holds, P_holds;
bool nxtCmt = 1;</declaration>
	<template>
		<name x="5" y="5">Absence_State_Before_Untimed</name>
		<declaration>// Place local declarations here.</declaration>
		<location id="id0" x="-620" y="-93">
			<name x="-671" y="-119">INIT</name>
			<committed/>
		</location>
		<location id="id1" x="-170" y="-42">
			<name x="-144" y="-51">SCOPECLOSED</name>
		</location>
		<location id="id2" x="-17" y="-93">
			<name x="-34" y="-76">ERROR</name>
		</location>
		<location id="id3" x="-161" y="-93">
		</location>
		<location id="id4" x="-314" y="-93">
		</location>
		<init ref="id0"/>
		<transition>
			<source ref="id0"/>
			<target ref="id1"/>
			<label kind="guard" x="-578" y="-34">R_holds == 1</label>
			<label kind="assignment" x="-578" y="-8">nxtCmt=0</label>
			<nail x="-620" y="-8"/>
			<nail x="-170" y="-8"/>
		</transition>
		<transition>
			<source ref="id0"/>
			<target ref="id4"/>
			<label kind="guard" x="-578" y="-119">R_holds == 0 &amp;&amp; P_holds == 0</label>
			<label kind="assignment" x="-578" y="-93">nxtCmt=0</label>
		</transition>
		<transition>
			<source ref="id0"/>
			<target ref="id3"/>
			<label kind="guard" x="-578" y="-170">R_holds == 0 &amp;&amp; P_holds == 1</label>
			<label kind="assignment" x="-578" y="-144">nxtCmt=0</label>
			<nail x="-620" y="-144"/>
			<nail x="-161" y="-144"/>
		</transition>
		<transition>
			<source ref="id4"/>
			<target ref="id1"/>
			<label kind="synchronisation" x="-280" y="-68">R_reached?</label>
			<nail x="-314" y="-42"/>
		</transition>
		<transition>
			<source ref="id3"/>
			<target ref="id2"/>
			<label kind="synchronisation" x="-127" y="-119">R_reached?</label>
		</transition>
		<transition>
			<source ref="id4"/>
			<target ref="id3"/>
			<label kind="synchronisation" x="-280" y="-119">P_reached?</label>
		</transition>
	</template>
	<system>// Place template instantiations here.
Observer = Absence_State_Before_Untimed();
// List one or more processes to be composed into a system.
system Observer;
    </system>
	<queries>
		<query>
			<formula>A[] not Observer.ERROR
			</formula>
			<comment>
			</comment>
		</query>
	</queries>
</nta>
