<?xml version="1.0" encoding="utf-8"?>
<!DOCTYPE nta PUBLIC "-//Uppaal Team//DTD Flat System 1.1//EN" "flat-1_1.dtd">
<nta>
	<declaration>// Place global declarations here.
broadcast chan P_reached, P_left;
bool P_holds;
int n_;
bool nxtCmt = 1;</declaration>
	<template>
		<name x="5" y="5">BoundedExistence_State_Globally_Untimed</name>
		<declaration>// Place local declarations here.
int counter = 0;</declaration>
		<location id="id0" x="195" y="-204">
			<name x="170" y="-187">ERROR</name>
		</location>
		<location id="id1" x="17" y="-204">
			<committed/>
		</location>
		<location id="id2" x="-408" y="-102">
			<committed/>
		</location>
		<location id="id3" x="-170" y="-204">
		</location>
		<location id="id4" x="-170" y="-102">
		</location>
		<location id="id5" x="-535" y="-102">
			<name x="-545" y="-136">INIT</name>
			<committed/>
		</location>
		<init ref="id5"/>
		<transition>
			<source ref="id1"/>
			<target ref="id0"/>
			<label kind="guard" x="51" y="-229">counter &gt; n_</label>
			<label kind="assignment" x="51" y="-204">nxtCmt=0</label>
		</transition>
		<transition>
			<source ref="id1"/>
			<target ref="id3"/>
			<label kind="guard" x="-119" y="-229">counter &lt;= n_</label>
			<label kind="assignment" x="-119" y="-204">nxtCmt=0</label>
		</transition>
		<transition>
			<source ref="id4"/>
			<target ref="id1"/>
			<label kind="synchronisation" x="-102" y="-136">P_reached?</label>
			<label kind="assignment" x="-136" y="-119">counter = counter+1,
nxtCmt=1</label>
			<nail x="17" y="-102"/>
		</transition>
		<transition>
			<source ref="id2"/>
			<target ref="id3"/>
			<label kind="guard" x="-348" y="-238">P_holds == 1</label>
			<label kind="assignment" x="-374" y="-221">counter = counter+1,
nxtCmt=0</label>
			<nail x="-408" y="-204"/>
		</transition>
		<transition>
			<source ref="id2"/>
			<target ref="id4"/>
			<label kind="guard" x="-340" y="-127">P_holds == 0</label>
			<label kind="assignment" x="-348" y="-102">nxtCmt=0</label>
		</transition>
		<transition>
			<source ref="id5"/>
			<target ref="id2"/>
			<label kind="assignment" x="-518" y="-119">counter = 0</label>
		</transition>
		<transition>
			<source ref="id3"/>
			<target ref="id4"/>
			<label kind="synchronisation" x="-161" y="-170">P_left?</label>
		</transition>
	</template>
	<system>// Place template instantiations here.
Observer = BoundedExistence_State_Globally_Untimed();
// List one or more processes to be composed into a system.
system Observer;
    </system>
	<queries>
		<query>
			<formula>A[] not Observer.ERROR
			</formula>
			<comment>
			</comment>
		</query>
	</queries>
</nta>
