<?xml version="1.0" encoding="utf-8"?>
<!DOCTYPE nta PUBLIC '-//Uppaal Team//DTD Flat System 1.1//EN' 'flat-1_1.dtd'>
<nta>
	<declaration>// Place global declarations here.
broadcast chan P_reached, S_reached;
int t1, t2;</declaration>
	<template>
		<name x="5" y="5">Response_State_Globally_Timed</name>
		<declaration>// Place local declarations here.
clock c;</declaration>
		<location id="id0" x="-620" y="-331">
		</location>
		<location id="id1" x="-374" y="-331">
			<name x="-384" y="-314">ERROR</name>
		</location>
		<location id="id2" x="-484" y="-331">
			<name x="-493" y="-314">wait</name>
		</location>
		<init ref="id0"/>
		<transition>
			<source ref="id2"/>
			<target ref="id1"/>
			<label kind="guard" x="-450" y="-348">c &gt; t2</label>
		</transition>
		<transition>
			<source ref="id0"/>
			<target ref="id2"/>
			<label kind="synchronisation" x="-595" y="-348">P_reached?</label>
			<label kind="assignment" x="-578" y="-331">c = 0</label>
		</transition>
		<transition>
			<source ref="id2"/>
			<target ref="id0"/>
			<label kind="guard" x="-620" y="-416">c &gt;= t1 &amp;&amp; c &lt;= t2</label>
			<label kind="synchronisation" x="-595" y="-399">S_reached?</label>
			<nail x="-484" y="-382"/>
			<nail x="-620" y="-382"/>
		</transition>
	</template>
	<system>// Place template instantiations here.
Observer = Response_State_Globally_Timed();
// List one or more processes to be composed into a system.
system Observer;
    </system>
	<queries>
		<query>
			<formula>A[] not Observer.ERROR
			</formula>
			<comment>
			</comment>
		</query>
	</queries>
</nta>
