<?xml version="1.0" encoding="utf-8"?>
<!DOCTYPE nta PUBLIC "-//Uppaal Team//DTD Flat System 1.1//EN" "flat-1_1.dtd">
<nta>
	<declaration>// Place global declarations here.
broadcast chan R_reached, Q_reached, P_reached, S_left;
bool S_holds, R_holds;</declaration>
	<template>
		<name x="5" y="5">ResponseInvariance_State_Between_Timed</name>
		<declaration>// Place local declarations here.
clock c;
int l = 3;
int u = 5;</declaration>
		<location id="id0" x="-442" y="-221">
			<committed/>
		</location>
		<location id="id1" x="-187" y="-221">
			<label kind="invariant" x="-204" y="-204">c &lt;= l</label>
		</location>
		<location id="id2" x="204" y="-85">
			<name x="187" y="-119">ERROR</name>
		</location>
		<location id="id3" x="-586" y="-221">
		</location>
		<location id="id4" x="51" y="-85">
		</location>
		<location id="id5" x="51" y="-221">
		</location>
		<location id="id6" x="-76" y="-221">
			<committed/>
		</location>
		<location id="id7" x="-297" y="-221">
		</location>
		<init ref="id3"/>
		<transition>
			<source ref="id0"/>
			<target ref="id3"/>
			<label kind="guard" x="-544" y="-195">R_holds == 1</label>
			<nail x="-451" y="-195"/>
			<nail x="-561" y="-195"/>
		</transition>
		<transition>
			<source ref="id0"/>
			<target ref="id7"/>
			<label kind="guard" x="-416" y="-238">R_holds == 0</label>
		</transition>
		<transition>
			<source ref="id3"/>
			<target ref="id0"/>
			<label kind="synchronisation" x="-568" y="-238">Q_reached?</label>
		</transition>
		<transition>
			<source ref="id1"/>
			<target ref="id6"/>
			<label kind="guard" x="-161" y="-246">c == l</label>
		</transition>
		<transition>
			<source ref="id7"/>
			<target ref="id1"/>
			<label kind="synchronisation" x="-279" y="-238">P_reached?</label>
			<label kind="assignment" x="-279" y="-221">c = 0</label>
		</transition>
		<transition>
			<source ref="id5"/>
			<target ref="id3"/>
			<label kind="guard" x="-568" y="-433">c &gt; u</label>
			<label kind="synchronisation" x="-568" y="-416">R_reached?</label>
			<nail x="51" y="-399"/>
			<nail x="-586" y="-399"/>
		</transition>
		<transition>
			<source ref="id4"/>
			<target ref="id2"/>
			<label kind="synchronisation" x="85" y="-102">R_reached?</label>
			<label kind="comments" x="69" y="-60">Not sure about this transition, but what else would be the difference between 'UNTIL' and 'BETWEEN'?</label>
		</transition>
		<transition>
			<source ref="id5"/>
			<target ref="id3"/>
			<label kind="guard" x="-568" y="-340">c &lt; l</label>
			<label kind="synchronisation" x="-568" y="-323">R_reached?</label>
			<nail x="51" y="-306"/>
			<nail x="-586" y="-306"/>
		</transition>
		<transition>
			<source ref="id7"/>
			<target ref="id3"/>
			<label kind="synchronisation" x="-416" y="-144">R_reached?</label>
			<nail x="-297" y="-144"/>
			<nail x="-586" y="-144"/>
		</transition>
		<transition>
			<source ref="id5"/>
			<target ref="id4"/>
			<label kind="guard" x="51" y="-187">c &lt; u &amp;&amp; c &gt; l</label>
			<label kind="synchronisation" x="51" y="-170">S_left?</label>
		</transition>
		<transition>
			<source ref="id6"/>
			<target ref="id4"/>
			<label kind="guard" x="-85" y="-136">S_holds == 0</label>
		</transition>
		<transition>
			<source ref="id6"/>
			<target ref="id5"/>
			<label kind="guard" x="-59" y="-246">S_holds == 1</label>
		</transition>
	</template>
	<system>// Place template instantiations here.
Process = ResponseInvariance_State_Between_Timed();
// List one or more processes to be composed into a system.
system Process;
    </system>
	<queries>
	</queries>
</nta>
