<?xml version="1.0" encoding="utf-8"?>
<!DOCTYPE nta PUBLIC "-//Uppaal Team//DTD Flat System 1.1//EN" "flat-1_1.dtd">
<nta>
	<declaration>broadcast chan Q_reached, R_reached;
broadcast chan P_left;
bool R_holds;
int t1, t2;</declaration>
	<template>
		<name x="5" y="5">Universality_State_Until_Timed</name>
		<declaration>clock c;</declaration>
		<location id="id0" x="-510" y="-221">
			<committed/>
		</location>
		<location id="id1" x="-195" y="-221">
			<name x="-221" y="-204">ERROR</name>
		</location>
		<location id="id2" x="-349" y="-221">
			<name x="-399" y="-255">SCOPEOPEN</name>
		</location>
		<location id="id3" x="-671" y="-221">
			<name x="-714" y="-212">INIT</name>
		</location>
		<init ref="id3"/>
		<transition>
			<source ref="id0"/>
			<target ref="id3"/>
			<label kind="guard" x="-654" y="-289">R_holds == 1</label>
			<nail x="-510" y="-272"/>
			<nail x="-671" y="-272"/>
		</transition>
		<transition>
			<source ref="id0"/>
			<target ref="id2"/>
			<label kind="guard" x="-493" y="-238">R_holds == 0</label>
		</transition>
		<transition>
			<source ref="id3"/>
			<target ref="id0"/>
			<label kind="synchronisation" x="-653" y="-238">Q_reached?</label>
			<label kind="assignment" x="-653" y="-221">c = 0</label>
		</transition>
		<transition>
			<source ref="id2"/>
			<target ref="id3"/>
			<label kind="synchronisation" x="-645" y="-161">R_reached?</label>
			<nail x="-348" y="-161"/>
			<nail x="-671" y="-161"/>
		</transition>
		<transition>
			<source ref="id2"/>
			<target ref="id1"/>
			<label kind="guard" x="-306" y="-263">c &gt;= t1 and c &lt;= t2</label>
			<label kind="synchronisation" x="-297" y="-246">P_left?</label>
		</transition>
	</template>
	<system>
Observer = Universality_State_Until_Timed();
system Observer;
    </system>
	<queries>
		<query>
			<formula>A[] (Observer.SCOPEOPEN and Observer.c == $t1) imply $P
			</formula>
			<comment>
			</comment>
		</query>
		<query>
			<formula>A[] Observer.INIT imply not $Q
			</formula>
			<comment>
			</comment>
		</query>
		<query>
			<formula>A[] not Observer.ERROR
			</formula>
			<comment>
			</comment>
		</query>
	</queries>
</nta>
